Name,Gender,Age,Occupation,Background,Hobbies,Likes,Dislikes
Ethan,Male,35,Nurse,"Ethan grew up in a small town in the Midwest of the US. He always had a passion for helping others, so he decided to go to nursing school after finishing high school. After graduating, he worked at a local hospital for a few years before moving to the city to pursue new opportunities. Ethan found his calling in the emergency room, where he works long hours saving lives and providing compassionate care to patients.",Ethan enjoys running and hiking in his free time. He also likes to read non-fiction books about history and science.,Ethan takes pride in his work as a nurse and finds great satisfaction in helping others. He also values spending time with his family and friends.,Ethan is not a fan of people who are inconsiderate or disrespectful. He also dislikes the way healthcare is often seen as a business rather than a service to those in need.
John,Male,45,Factory Worker,John comes from a blue-collar family and has been working in a factory for over 20 years. He takes pride in his job and enjoys the sense of community among his fellow workers. He has a high school education but has taken various trade courses to improve his skills.,"John enjoys spending time outdoors, fishing, and taking his motorcycle for long rides. He also volunteers at a local community center teaching woodworking classes to children.","John is a family-oriented person and values spending quality time with his wife and two children. He also enjoys attending local concerts and events with his friends, trying new foods, and listening to classic rock music.","John dislikes injustice, dishonesty, and disrespect. He finds it frustrating when people don't appreciate the value of hard work and perseverance. John also dislikes technology and prefers to live a simple life without being heavily reliant on gadgets and social media."
Maria Rodriguez,Female,45,Factory Worker,"Maria grew up in a working-class family in a small town. She is the oldest of four siblings and had to drop out of high school to help support her family. She worked odd jobs until she landed a position at the factory, where she has been working for over 20 years.","Maria loves to read, especially romance novels. She also enjoys knitting and crocheting, and has even started selling some of her creations online.","Maria is a hard worker and takes pride in doing a good job. She enjoys spending time with her kids and grandkids, and loves taking care of them. She also loves to cook and tries out new recipes in her free time.","Maria is not a fan of change and can be resistant to new technology or processes at work. She also dislikes loud noises and prefers quiet activities. Additionally, she is not a fan of reality TV shows or gossip."
David,Male,45,Nurse,David has been a nurse for 20 years and has worked in various specialties. He is compassionate and dedicated to his patients' health and well-being. He is respected by his colleagues for his expertise and willingness to go above and beyond for his patients.,"David enjoys going for long walks in nature, trying new recipes in the kitchen, and spending time with his family.",He likes being able to make a positive impact on his patients' lives and seeing them regain their health. He also appreciates the camaraderie among his colleagues and how they work together to provide the best care for their patients.,David dislikes seeing patients suffer due to inadequate care or resources. He also dislikes how the healthcare system can be complicated and difficult for patients to navigate.
David Johnson,Male,45,Nurse,"David grew up in a small town in the Midwest, where he learned the importance of hard work and community involvement. He followed in his mother's footsteps by pursuing a career in nursing, and has been practicing for over 20 years. He has worked in a variety of medical settings, including hospitals, clinics, and home health care. David is known for his compassionate approach to patient care, and is respected by his colleagues for his dedication and professionalism.","David enjoys spending time outdoors, hiking, and camping with his family. He is also an avid reader and enjoys listening to music.","David is passionate about improving the health and well-being of his patients. He enjoys learning about new treatments and technologies, and is always looking for ways to improve his skills and knowledge.","David is frustrated by the current state of the healthcare system, particularly the lack of resources and support for nurses. He also dislikes seeing patients struggle with chronic conditions that could have been prevented with better education and access to healthcare."
